{
  "schema_version": "0.1.0",
  "memory_id": "PL.MEM.PLATO_0_1_TEST.ACQUIRED.TEST001",
  "instance_id": "PLATO-0.1-TEST",
  "memory_type": "ACQUIRED",
  "created_at": "2026-10-04T20:00:00Z",
  "updated_at": null,
  "content": {
    "text": "The interlocutor reports that a synthetic test object exists.",
    "language": "en",
    "normalized_proposition": "A synthetic test object exists."
  },
  "epistemic_status": "REPORTED",
  "confidence": null,
  "source_actor": "test-interlocutor",
  "conversation_id": "TEST-CONVERSATION-001",
  "event_id": "TEST-EVENT-001",
  "derived_from": [],
  "provenance_ids": [
    "PL.PROV.TEST001"
  ],
  "supersedes_memory_id": null,
  "status": "ACTIVE"
}
